{"$schema":"../../schemas/article-research.schema.v1.json","schemaVersion":"1.0","articleId":"core.empty-cosmos-latent-video","node":{"classType":"EmptyCosmosLatentVideo","pythonModule":"comfy_extras.nodes_cosmos","origin":"backend"},"baseline":{"comfyui":"0.32.0","frontend":"1.48.7","sourceCommit":"c2bcbecd82ec5ae66594340b395c24ef0217b238","embeddedDocs":"0.5.9","workflowTemplatesJson":"0.1.42"},"state":"fact_checked","reviewMode":"automated_assisted","evidence":{"runtimeInventory":"runtime/comfyui-0.32.0.object-info.json","sourceLocations":[{"url":"https://github.com/Comfy-Org/ComfyUI/blob/c2bcbecd82ec5ae66594340b395c24ef0217b238/comfy_extras/nodes_cosmos.py#L11-L29","path":"comfy_extras/nodes_cosmos.py","lines":"11-29"}],"embeddedDocs":[{"locale":"en","archivePath":"comfyui_embedded_docs/docs/EmptyCosmosLatentVideo/en.md","assessment":"SHA-256 8ad90c80e3e962c7bfb1ed2fff036bf183c882d5de8c1758c7fde54b87feac8a; параметры проверены."},{"locale":"ru","archivePath":"comfyui_embedded_docs/docs/EmptyCosmosLatentVideo/ru.md","assessment":"SHA-256 f5380a39e11ead21ed2f51631f469f53b5228433905d55dfcd296e89b8345dcd; форма сверена."}],"workflows":[{"id":"workflow-0142-zero-census","role":"В 768 официальных графах точных экземпляров нет."}]},"checks":{"implementationRead":true,"runtimeCompared":true,"officialCasesInspected":true,"exampleSchemaValidated":true,"exampleExecuted":false,"russianEdited":true,"factsRecheckedAfterEditing":true},"knownGaps":["Модель Cosmos не запускалась; человеческое утверждение ещё не получено."],"updatedAt":"2026-08-20"}
