{"$schema":"../../schemas/article-research.schema.v1.json","schemaVersion":"1.0","articleId":"custom.comfyui-timesaver.ts-h3audioinject","node":{"classType":"TS_H3AudioInject","pythonModule":"custom_nodes.comfyui-timesaver","origin":"backend"},"baseline":{"comfyui":"0.32.0","frontend":"1.48.7","sourceCommit":"c1668b3cfa2161e36bf9b9fa91288b949b4b0b1f","embeddedDocs":"comfyui-timesaver built-in docs","workflowTemplatesJson":"comfyui-timesaver examples at pinned commit"},"state":"source_reviewed","reviewMode":"automated_assisted","evidence":{"runtimeInventory":"content/inventory/custom/comfyui-timesaver.json","sourceLocations":[{"url":"https://github.com/AlexYez/comfyui-timesaver/blob/c1668b3cfa2161e36bf9b9fa91288b949b4b0b1f/nodes/video/ts_h3_audio_inject.py#L232","path":"nodes/video/ts_h3_audio_inject.py","lines":"232+"}],"embeddedDocs":[{"locale":"ru","archivePath":"js/docs/TS_H3AudioInject/ru.md","assessment":"Primary pack documentation imported and attributed"}],"workflows":[]},"checks":{"implementationRead":false,"runtimeCompared":false,"officialCasesInspected":false,"exampleSchemaValidated":false,"exampleExecuted":false,"russianEdited":false,"factsRecheckedAfterEditing":false},"knownGaps":["Human editorial approval pending"],"updatedAt":"2026-09-27"}
