{
  "$schema": "../../schemas/article-research.schema.v1.json",
  "schemaVersion": "1.0",
  "articleId": "core.save-image",
  "node": { "classType": "SaveImage", "pythonModule": "nodes", "origin": "backend" },
  "baseline": { "comfyui": "0.32.0", "frontend": "1.48.7", "sourceCommit": "c2bcbecd82ec5ae66594340b395c24ef0217b238", "embeddedDocs": "0.5.9", "workflowTemplatesJson": "0.1.42" },
  "state": "fact_checked",
  "reviewMode": "automated_assisted",
  "evidence": {
    "runtimeInventory": "runtime/comfyui-0.32.0.object-info.json",
    "sourceLocations": [{ "url": "https://github.com/Comfy-Org/ComfyUI/blob/v0.32.0/nodes.py#L1481-L1551", "path": "nodes.py", "lines": "1481-1551" }],
    "embeddedDocs": [{ "locale": "ru", "archivePath": "comfyui_embedded_docs/docs/SaveImage/ru.md", "assessment": "Назначение сверено; имена файлов, PNG metadata и batch взяты из реализации." }],
    "workflows": [{ "id": "sd3.5_simple_example", "role": "Постоянный PNG после VAEDecode." }, { "id": "flux_schnell", "role": "Та же output-граница в Flux workflow." }]
  },
  "checks": { "implementationRead": true, "runtimeCompared": true, "officialCasesInspected": true, "exampleSchemaValidated": true, "exampleExecuted": false, "russianEdited": true, "factsRecheckedAfterEditing": true },
  "knownGaps": ["Запись на Windows, Linux и macOS не прогнана в этой редакционной итерации."],
  "updatedAt": "2026-08-13"
}
