{"$schema":"../../schemas/article-research.schema.v1.json","schemaVersion":"1.0","articleId":"core.curve-editor","node":{"classType":"CurveEditor","pythonModule":"comfy_extras.nodes_curve","origin":"backend"},"baseline":{"comfyui":"0.32.0","frontend":"1.48.7","sourceCommit":"c2bcbecd82ec5ae66594340b395c24ef0217b238","embeddedDocs":"0.5.9","workflowTemplatesJson":"0.1.42"},"state":"fact_checked","reviewMode":"automated_assisted","evidence":{"runtimeInventory":"runtime/comfyui-0.32.0.object-info.json","sourceLocations":[{"url":"https://github.com/Comfy-Org/ComfyUI/blob/c2bcbecd82ec5ae66594340b395c24ef0217b238/comfy_extras/nodes_curve.py#L8-L33","path":"comfy_extras/nodes_curve.py","lines":"8-33"},{"url":"https://github.com/Comfy-Org/ComfyUI/blob/c2bcbecd82ec5ae66594340b395c24ef0217b238/comfy_api/latest/_input/curve_types.py#L14-L176","path":"comfy_api/latest/_input/curve_types.py","lines":"14-176"},{"url":"https://github.com/Comfy-Org/ComfyUI_frontend/tree/6d6af63c00f132cd25dc29307fc56bd2c094fa22/src/components/curve","path":"src/components/curve","lines":"WidgetCurve.vue, curveUtils.ts"}],"embeddedDocs":[{"locale":"en","archivePath":"comfyui_embedded_docs/docs/CurveEditor/en.md","assessment":"SHA-256 6aade13208261e2b97460e255ff301f52540a26a5bf59048344cf62d3497b4e1."},{"locale":"ru","archivePath":"comfyui_embedded_docs/docs/CurveEditor/ru.md","assessment":"SHA-256 2f74ce53fb43cdda0c30eb87463dc95bb31a1db40061cf82783ff01ce754f879."}],"workflows":[{"id":"basic_image_color_adjustment","role":"Four CurveEditor instances: RGB master and three channels, each connected to GLSLShader."}]},"checks":{"implementationRead":true,"runtimeCompared":true,"officialCasesInspected":true,"exampleSchemaValidated":true,"exampleExecuted":false,"russianEdited":true,"factsRecheckedAfterEditing":true},"knownGaps":["Полный граф с GLSLShader не выполнялся; визуальный результат не оценивался.","Человеческое утверждение ожидается."],"updatedAt":"2026-08-20"}
