{
  "$schema": "../../schemas/article-research.schema.v1.json",
  "schemaVersion": "1.0",
  "articleId": "core.latent-upscale",
  "node": {
    "classType": "LatentUpscale",
    "pythonModule": "nodes",
    "origin": "backend"
  },
  "baseline": {
    "comfyui": "0.32.0",
    "frontend": "1.48.7",
    "sourceCommit": "c2bcbecd82ec5ae66594340b395c24ef0217b238",
    "embeddedDocs": "0.5.9",
    "workflowTemplatesJson": "0.1.42"
  },
  "state": "fact_checked",
  "reviewMode": "automated_assisted",
  "evidence": {
    "runtimeInventory": "runtime/comfyui-0.32.0.object-info.json",
    "sourceLocations": [
      {
        "url": "https://github.com/Comfy-Org/ComfyUI/blob/v0.32.0/nodes.py#L1329-L1363",
        "path": "nodes.py",
        "lines": "1329-1363"
      },
      {
        "url": "https://github.com/Comfy-Org/ComfyUI/blob/v0.32.0/comfy/utils.py#L983-L1101",
        "path": "comfy/utils.py",
        "lines": "983-1101"
      }
    ],
    "embeddedDocs": [
      {
        "locale": "ru",
        "archivePath": "comfyui_embedded_docs/docs/LatentUpscale/ru.md",
        "assessment": "Даёт общее назначение и неверно переводит системные имена полей. Не описывает минимум 64, hardcoded width//8 и height//8, no-op при двух нулях, shallow copy остальных полей, точный center crop и алгоритм bislerp."
      }
    ],
    "workflows": [
      {
        "id": "pinned-package-census-0.1.42",
        "role": "Рекурсивный обход top-level и subgraph nodes во всех 496 JSON не нашёл ни одного LatentUpscale."
      },
      {
        "id": "hiresfix_latent_workflow",
        "role": "В официальном legacy PNG первый KSampler ведёт в LatentUpscale nearest-exact 1152 × 1152 disabled, затем во второй KSampler с denoise 0.5, VAEDecode и SaveImage."
      }
    ]
  },
  "checks": {
    "implementationRead": true,
    "runtimeCompared": true,
    "officialCasesInspected": true,
    "exampleSchemaValidated": true,
    "exampleExecuted": false,
    "russianEdited": true,
    "factsRecheckedAfterEditing": true
  },
  "knownGaps": [
    "Прямого случая LatentUpscale в закреплённом workflow-пакете 0.1.42 нет; recipe опирается на отдельно проверенный legacy official example.",
    "Fragment структурно проверен, но второй sampling-проход не исполнен.",
    "Человеческое редакционное утверждение не выполнено."
  ],
  "updatedAt": "2026-08-13"
}
