{"$schema":"../../schemas/article-research.schema.v1.json","schemaVersion":"1.0","articleId":"core.text-encode-boogu-edit","node":{"classType":"TextEncodeBooguEdit","pythonModule":"comfy_extras.nodes_boogu","origin":"backend"},"baseline":{"comfyui":"0.32.0","frontend":"1.48.7","sourceCommit":"c2bcbecd82ec5ae66594340b395c24ef0217b238","embeddedDocs":"0.5.9","workflowTemplatesJson":"0.1.42"},"state":"fact_checked","reviewMode":"automated_assisted","evidence":{"runtimeInventory":"runtime/comfyui-0.32.0.object-info.json","sourceLocations":[{"url":"https://github.com/Comfy-Org/ComfyUI/blob/c2bcbecd82ec5ae66594340b395c24ef0217b238/comfy_extras/nodes_boogu.py#L9-L100","path":"comfy_extras/nodes_boogu.py","lines":"9-100"}],"embeddedDocs":[{"locale":"en","archivePath":"comfyui_embedded_docs/docs/TextEncodeBooguEdit/en.md","assessment":"SHA-256 5dc62465caa8200becba75e012b114a09d345a37df348e5096fc0af70fef7065."},{"locale":"ru","archivePath":"comfyui_embedded_docs/docs/TextEncodeBooguEdit/ru.md","assessment":"SHA-256 ac39440f9d00a9ee06e413ac17c7f63033e6fe91bbd8ed0d4e09440ea07ef6d0."}],"workflows":[{"id":"boogu-edit-two","role":"Two exact cases with prompts and empty negative."}]},"checks":{"implementationRead":true,"runtimeCompared":true,"officialCasesInspected":true,"exampleSchemaValidated":true,"exampleExecuted":false,"russianEdited":true,"factsRecheckedAfterEditing":true},"knownGaps":["CLIP/VAE and full Boogu workflows not executed.","Человеческое утверждение ожидается."],"updatedAt":"2026-08-20"}
