{"$schema":"../../schemas/article-research.schema.v1.json","schemaVersion":"1.0","articleId":"core.reference-latent","node":{"classType":"ReferenceLatent","pythonModule":"comfy_extras.nodes_edit_model","origin":"backend"},"baseline":{"comfyui":"0.32.0","frontend":"1.48.7","sourceCommit":"c2bcbecd82ec5ae66594340b395c24ef0217b238","embeddedDocs":"0.5.9","workflowTemplatesJson":"0.1.42"},"state":"fact_checked","reviewMode":"automated_assisted","evidence":{"runtimeInventory":"runtime/comfyui-0.32.0.object-info.json","sourceLocations":[{"url":"https://github.com/Comfy-Org/ComfyUI/blob/c2bcbecd82ec5ae66594340b395c24ef0217b238/comfy_extras/nodes_edit_model.py#L6-L30","path":"comfy_extras/nodes_edit_model.py","lines":"6-30"}],"embeddedDocs":[{"locale":"en","archivePath":"comfyui_embedded_docs/docs/ReferenceLatent/en.md","assessment":"SHA-256 2c10d037ca363d0ac2b3d49e1434a6d7bf51dd9f0ccdffb8b19b3db4ed906eeb."},{"locale":"ru","archivePath":"comfyui_embedded_docs/docs/ReferenceLatent/ru.md","assessment":"SHA-256 7209a16387800409c028a502cc5e530ee1f9ec5c9003ca1b875fa8e23f52470c."}],"workflows":[{"id":"workflow-0142-reference-latent-46","role":"46 exact nodes in 14 templates; no widgets."}]},"checks":{"implementationRead":true,"runtimeCompared":true,"officialCasesInspected":true,"exampleSchemaValidated":true,"exampleExecuted":false,"russianEdited":true,"factsRecheckedAfterEditing":true},"knownGaps":["Совместимая edit-модель и полная цепочка не выполнялись.","Человеческое утверждение ожидается."],"updatedAt":"2026-08-20"}
