{"$schema":"../../schemas/article-research.schema.v1.json","schemaVersion":"1.0","articleId":"core.controlnet-inpainting-alimama-apply","node":{"classType":"ControlNetInpaintingAliMamaApply","pythonModule":"comfy_extras.nodes_controlnet","origin":"backend"},"baseline":{"comfyui":"0.32.0","frontend":"1.48.7","sourceCommit":"c2bcbecd82ec5ae66594340b395c24ef0217b238","embeddedDocs":"0.5.9","workflowTemplatesJson":"0.1.42"},"state":"fact_checked","reviewMode":"automated_assisted","evidence":{"runtimeInventory":"runtime/comfyui-0.32.0.object-info.json","sourceLocations":[{"url":"https://github.com/Comfy-Org/ComfyUI/blob/c2bcbecd82ec5ae66594340b395c24ef0217b238/comfy_extras/nodes_controlnet.py#L38-L77","path":"comfy_extras/nodes_controlnet.py","lines":"38-77"}],"embeddedDocs":[],"workflows":[]},"checks":{"implementationRead":true,"runtimeCompared":true,"officialCasesInspected":true,"exampleSchemaValidated":true,"exampleExecuted":false,"russianEdited":true,"factsRecheckedAfterEditing":true},"knownGaps":["AliMama inpaint не исполнялся.","Человеческое утверждение ожидается."],"updatedAt":"2026-08-20"}
