{
  "$schema": "../../schemas/article-research.schema.v1.json",
  "schemaVersion": "1.0",
  "articleId": "core.image-rgb-to-yuv",
  "node": {"classType": "ImageRGBToYUV", "pythonModule": "comfy_extras.nodes_morphology", "origin": "backend"},
  "baseline": {"comfyui": "0.32.0", "frontend": "1.48.7", "sourceCommit": "c2bcbecd82ec5ae66594340b395c24ef0217b238", "embeddedDocs": "0.5.9", "workflowTemplatesJson": "0.1.42"},
  "state": "fact_checked",
  "reviewMode": "automated_assisted",
  "evidence": {
    "runtimeInventory": "runtime/comfyui-0.32.0.object-info.json",
    "sourceLocations": [
      {"url": "https://github.com/Comfy-Org/ComfyUI/blob/c2bcbecd82ec5ae66594340b395c24ef0217b238/comfy_extras/nodes_morphology.py#L56-L77", "path": "comfy_extras/nodes_morphology.py", "lines": "56-77"},
      {"url": "https://github.com/kornia/kornia/blob/v0.8.3/kornia/color/ycbcr.py", "path": "installed kornia 0.8.3: kornia/color/ycbcr.py", "lines": "rgb_to_ycbcr and _rgb_to_y"}
    ],
    "embeddedDocs": [{"locale": "ru", "archivePath": "comfyui_embedded_docs/docs/ImageRGBToYUV/ru.md", "assessment": "Общее назначение верно, но код фактически использует YCbCr, требует ровно RGB и расширяет каждую скалярную компоненту до трёх одинаковых каналов; это добавлено по источнику и execution."}],
    "workflows": []
  },
  "checks": {"implementationRead": true, "runtimeCompared": true, "officialCasesInspected": true, "exampleSchemaValidated": true, "exampleExecuted": false, "russianEdited": true, "factsRecheckedAfterEditing": true},
  "knownGaps": ["Exhaustive scan official workflow templates JSON 0.1.42 не нашёл ImageRGBToYUV; fragment не объявлен официальным.", "RGB→components→RGB round-trip исполнен на synthetic batch; полный Preview fragment ещё не запускался.", "Человеческое редакционное утверждение не выполнено."],
  "updatedAt": "2026-08-13"
}
