{
  "$schema": "../../schemas/article-research.schema.v1.json",
  "schemaVersion": "1.0",
  "articleId": "custom.comfyui-timesaver.ts-batchsource",
  "node": {
    "classType": "TS_BatchSource",
    "pythonModule": "custom_nodes.comfyui-timesaver",
    "origin": "backend"
  },
  "baseline": {
    "comfyui": "0.32.0",
    "frontend": "1.48.7",
    "sourceCommit": "819d4e573a266fbc2aafb10554943f1e781c351a",
    "embeddedDocs": "comfyui-timesaver built-in docs",
    "workflowTemplatesJson": "comfyui-timesaver examples at pinned commit"
  },
  "state": "source_reviewed",
  "reviewMode": "automated_assisted",
  "evidence": {
    "runtimeInventory": "content/inventory/custom/comfyui-timesaver.json",
    "sourceLocations": [
      {
        "url": "https://github.com/AlexYez/comfyui-timesaver/blob/819d4e573a266fbc2aafb10554943f1e781c351a/nodes/utils/ts_batch_source.py#L320",
        "path": "nodes/utils/ts_batch_source.py",
        "lines": "320+"
      }
    ],
    "embeddedDocs": [
      {
        "locale": "ru",
        "archivePath": "js/docs/TS_BatchSource/ru.md",
        "assessment": "Primary pack documentation imported and attributed"
      }
    ],
    "workflows": []
  },
  "checks": {
    "implementationRead": true,
    "runtimeCompared": false,
    "officialCasesInspected": false,
    "exampleSchemaValidated": false,
    "exampleExecuted": false,
    "russianEdited": true,
    "factsRecheckedAfterEditing": true
  },
  "knownGaps": [
    "Требуется человеческое утверждение",
    "Live custom-pack runtime and full model workflow execution not verified"
  ],
  "updatedAt": "2026-10-03"
}
