{"$schema":"../../schemas/article-research.schema.v1.json","schemaVersion":"1.0","articleId":"core.save-lora-weights","node":{"classType":"SaveLoRA","pythonModule":"comfy_extras.nodes_train","origin":"backend"},"baseline":{"comfyui":"0.32.0","frontend":"1.48.7","sourceCommit":"c2bcbecd82ec5ae66594340b395c24ef0217b238","embeddedDocs":"0.5.9","workflowTemplatesJson":"0.1.42"},"state":"fact_checked","reviewMode":"automated_assisted","evidence":{"runtimeInventory":"runtime/comfyui-0.32.0.object-info.json","sourceLocations":[{"url":"https://github.com/Comfy-Org/ComfyUI/blob/c2bcbecd82ec5ae66594340b395c24ef0217b238/comfy_extras/nodes_train.py#L1364-L1406","path":"comfy_extras/nodes_train.py","lines":"1364-1406"}],"embeddedDocs":[{"locale":"en","archivePath":"comfyui_embedded_docs/docs/SaveLoRA/en.md","assessment":"SHA-256 fa7eaa62a4ee1a8f4ea3cb33456509d4def53d91b78293e5512035e7fa189d16; контракт входов сверён."},{"locale":"ru","archivePath":"comfyui_embedded_docs/docs/SaveLoRA/ru.md","assessment":"SHA-256 12912d0a5d37e46cd84842ef7a7c83aa93f6d3f022586cee75fcbea023dcdff0; назначение сверено."}],"workflows":[{"id":"workflow-0142-zero-census","role":"В 768 графах точных экземпляров ноды нет."}]},"checks":{"implementationRead":true,"runtimeCompared":true,"officialCasesInspected":true,"exampleSchemaValidated":true,"exampleExecuted":false,"russianEdited":true,"factsRecheckedAfterEditing":true},"knownGaps":["Настоящий LORA_MODEL и запись safetensors не исполнялись.","Человеческое утверждение ожидается."],"updatedAt":"2026-08-20"}
